"kode","nama","warna","kelas_pyramid","durasi_tunggakan","profil_perilaku","posisi_pyramid_djp"
"H1","Patuh Aktif","HIJAU","Basis Patuh","Belum jatuh tempo","Wajib pajak yang disiplin. Membayar sebelum atau pada saat jatuh tempo. Kebiasaan sudah terbentuk dan stabil.","Basis pyramid — mau dan mampu. Intervensi: menjaga kepatuhan, bukan membangun kepatuhan baru."
"K1","Baru Lewat Jatuh Tempo","KUNING","Goyah Awal","1-90 hari + ada riwayat","Lupa atau sibuk. Niat membayar masih ada. Akumulasi denda kecil dan belum jadi beban.","Peralihan dari patuh ke goyah. Pengingat ringan sudah cukup mengembalikan kepatuhan."
"O1","Mulai Mengabaikan","ORANYE","Goyah Lanjut","91-365 hari + ada riwayat","Mulai lalai. Pajak tergeser dari prioritas. Mungkin kendala keuangan atau hilang urgensi. Denda mulai memberatkan.","Goyah menuju tidak mau. Diperlukan intervensi lebih dari sekadar pengingat — friksi perlu dikurangi."
"M1","Tidak Patuh Pasif","MERAH","Tidak Mau Pasif","1-2 tahun + ada riwayat","Sudah ambil keputusan pasif untuk tidak membayar. Akumulasi denda jadi penghalang nyata — total kewajiban bisa mendekati atau melebihi pokok pajak.","Tidak mau pasif. Denda bukan lagi sekadar konsekuensi, melainkan tembok penghalang. Amnesti parsial dipertimbangkan."
"M2","Tidak Patuh Kronis","MERAH","Tidak Mau Mengakar","2-5+ tahun + ada riwayat","Ketidakpatuhan mengakar. Denda 2-4× pokok pajak. Tanpa intervensi mendasar, kendaraan tidak akan kembali ke sistem.","Tidak mau mengakar. Amnesti penuh denda diperlukan sebagai satu-satunya pengungkit realistis."
"S1","Belum Terdaftar","ABU","Luar Pyramid","Tidak pernah membayar (≤15 thn)","Pembelian tangan kedua tanpa balik nama. 97.5% sepeda motor. Hanya 2% punya nomor HP tercatat.","Di luar pyramid DJP — belum pernah masuk sistem. Penghalang utama: biaya & kerumitan balik nama, bukan denda."
"S2","Kendaraan Hantu","ABU","Luar Pyramid","Tidak pernah membayar (>15 thn) atau >5 thn tunggakan + >20 thn usia","Diasumsikan sudah dibuang/rusak permanen/pindah wilayah tanpa mutasi. Hanya 19% punya HP.","Di luar pyramid — bukan target kampanye. Tindakan yang tepat: verifikasi registrasi & pembersihan data."
