"source","category","chunk_text","chunk_metadata"
"framework_v1.4_vocabulary","istilah_pajak","Vocabulary aliases (Bahasa Indonesia ↔ technical terms): 'tunggakan' = arrears = piutang pajak. 'denda' = penalty (sanksi telat bayar). 'pokok' = principal (pajak dasar). 'BBNKB' = Bea Balik Nama Kendaraan Bermotor (one-time saat transfer ownership). 'PKB' = Pajak Kendaraan Bermotor (annual, recurring). 'SWDKLLJ' = Sumbangan Wajib Dana Kecelakaan Lalu Lintas Jalan (slice Jasa Raharja, Rp 35K motor / Rp 143K mobil / Rp 163K truk). 'opsen' = surcharge provincial (PAD pemda). 'sd_notice' = tanggal jatuh tempo STNK = surat dispense notice. 'tahun_buat' = tahun pembuatan kendaraan. 'kendaraan dinas' = government-owned vehicles.","{}"
"framework_v1.4_vocabulary","istilah_program","Vocabulary program SADAR (Bahasa daerah Dayak): 'Hayak Bahayau' = nama program Duta Pajak kelurahan (artinya 'kebersamaan' dalam bahasa Dayak Ngaju). 'Huma Betang Mahaga' = nama alternatif Duta Pajak (Huma Betang = rumah panjang Dayak, Mahaga = melestarikan). 'Taka' = mari/ayo (bahasa Dayak), digunakan dalam tagline pengingat: 'Taka bayar pajak kendaraan, agari Kalteng makin maju'. 'agari' = supaya (bahasa Dayak). Penggunaan bahasa daerah dalam pesan WhatsApp ke H1 dan K1 untuk membangun kedekatan emosional.","{}"
"framework_v1.4_vocabulary","istilah_kanal","Vocabulary kanal layanan: 'SAMSAT' = Sistem Administrasi Manunggal Satu Atap (one-stop kantor pajak kendaraan). 'SAMSAT Keliling' = mobile SAMSAT yang berkeliling kecamatan/desa. 'SAMKEL' = nama lain SAMSAT Keliling. 'BUMDES' = Badan Usaha Milik Desa (untuk kolaborasi titik layanan rural). 'BRILink' = agen perbankan BRI (untuk pembayaran rural). 'PT POS' = Pos Indonesia (titik layanan rural). 'ETLE' = Electronic Traffic Law Enforcement (kamera pelanggaran lalu lintas terintegrasi). 'WA Gateway' = WhatsApp Business API gateway untuk kirim massal. 'Duta Pajak' = volunteer kelurahan untuk sosialisasi pajak.","{}"
"framework_v1.4_segmen_jenken_h1","komposisi_jenken_h1","Komposisi jenis kendaraan di segmen H1 (Patuh Aktif, 107,967 kendaraan): SEPEDA MOTOR 76,309 unit (70.7% volume, 17.3% nilai PKB, avg PKB Rp 122,712, usia 6.6 tahun). MINIBUS 21,703 (20.1% volume, 51.6% nilai, avg Rp 1,284,741, usia 9.2 tahun). PICK UP 4,579 (4.2% volume, 11.0% nilai, avg Rp 1,301,059, usia 7.8 tahun). JEEP 2,067 (1.9% volume, 8.9% nilai, avg Rp 2,316,498, usia 14.8 tahun). TRUCK DUMP 1,108 (1.0% volume, 4.5% nilai, avg Rp 2,215,921, usia 8.1 tahun). Phone availability 99.99% di hampir semua jenken. Insight: meskipun motor dominan (70.7% volume), MINIBUS menyumbang 51.6% nilai PKB.","{}"
"framework_v1.4_segmen_jenken_m2","komposisi_jenken_m2","Komposisi jenis kendaraan di segmen M2 (Tidak Patuh Kronis, 140,966 kendaraan, segmen TERBESAR): SEPEDA MOTOR 128,121 unit (90.9% volume, 46.3% nilai, avg Rp 122,712, usia 12.7 tahun). MINIBUS 4,927 (3.5% volume, 18.6% nilai, avg Rp 1,284,741, usia 14 tahun). PICK UP 4,165 (3.0% volume, 16.0% nilai, avg Rp 1,301,059, usia 13.6 tahun). TRUCK DUMP 1,404 (1.0% volume, 9.2% nilai, avg Rp 2,215,921, usia 12.3 tahun). JEEP 716 (0.5% volume, 4.9% nilai, usia 21.9 tahun). Phone availability VARIES per jenken: motor 69.6% (rendah), minibus 91.9%, jeep 97.1%. Implikasi: M2 motor (segment terbesar dengan 128K kendaraan) butuh hybrid digital + offline karena 30% tanpa HP. M2 fleet (truck/jeep) lebih reach-able digital.","{}"
"framework_v1.4_segmen_jenken_s1","komposisi_jenken_s1","Komposisi jenis kendaraan di segmen S1 (Belum Terdaftar, 12,756 kendaraan): SEPEDA MOTOR 12,435 unit (97.5% volume, 76.3% nilai, avg Rp 122,712, usia 14.3 tahun). PICK UP 178 (1.4% volume, 11.6% nilai). TRUCK DUMP 76 (0.6% volume, 8.4% nilai). MINIBUS 50 (0.4% volume, 3.2% nilai). Phone availability sangat rendah: motor 0.83%, pickup 6.2%, minibus 6%, truck 100% (anomali). Insight kritis: 97.5% S1 = motor tangan-kedua tanpa balik nama. Hampir tidak ada channel digital (motor hanya 0.83% punya HP). Strategi: pendekatan komunitas (RT/RW, Duta Pajak), SAMSAT Keliling dengan kapabilitas balik nama, BUMDES/BRILink sebagai titik layanan.","{}"
"framework_v1.4_segmen_jenken_s2","komposisi_jenken_s2","Komposisi jenis kendaraan di segmen S2 (Kendaraan Hantu, 74,544 kendaraan): SEPEDA MOTOR 67,156 unit (90.1% volume, 42.7% nilai, avg usia 22.9 tahun). MINIBUS 2,551 (3.4% volume, 17.0% nilai, usia 30.2 tahun). PICK UP 1,518 (2.0% volume, 10.2% nilai, usia 32.4 tahun). JEEP 1,240 (1.7% volume, 14.9% nilai, usia 35.3 tahun). SEDAN 868 (1.2% volume, usia 36.7 tahun). Rata-rata usia kendaraan 22-37 tahun — strong indicator bahwa kendaraan kemungkinan sudah tidak ada fisik. Phone availability bervariasi tapi rata-rata rendah (motor 16.7%, minibus 42%, jeep 41.5%). Implikasi: jangan dikirimi kampanye, fokus data cleanup.","{}"
"paper_saptono_khozen","crm_definition","Compliance Risk Management (CRM) per OECD (2004) didefinisikan sebagai 'a structured process for the systematic identification, assessment, ranking, and treatment of tax compliance risks'. Seperti manajemen risiko pada umumnya, CRM merupakan proses iteratif yang terdiri dari tahapan-tahapan untuk meningkatkan proses pengambilan keputusan. Indonesia mengadopsi CRM via DJP SE-24/PJ/2019 dan SE-15/PJ/2018. Inti CRM: WP dengan rekam jejak rendah dapat penegakan ketat, WP cukup patuh dapat pengawasan longgar — meningkatkan efisiensi resource sekaligus keadilan.","{}"
"paper_saptono_khozen","pyramid_kepatuhan","Piramida Kepatuhan Pajak (Ayres & Braithwaite 1992; OECD 2004; Kirchler & Hoelzl 2017) membagi WP ke dalam empat tingkat: (1) compliant — sudah patuh; (2) attempt to comply but fail — ingin patuh namun gagal; (3) general non-compliant — tidak patuh; (4) deliberate fraud — tidak mau patuh dan melawan hukum. Strategi otoritas berbeda per tingkat: untuk yang patuh, dukung self-assessment dan kemudahan; untuk yang gagal, edukasi dan asistensi; untuk yang tidak patuh, deterrence; untuk yang sengaja melawan, full force of law. Framework v1.4 mengembangkan pyramid ini menjadi 7 segmen lebih granular plus 2 segmen out-of-pyramid (S1, S2).","{}"
"paper_saptono_khozen","data_matching","Risk-based audit yang relevan dengan CRM termasuk data matching: pengecekan konsistensi pajak return dengan data bea cukai, bank, asuransi, dan return WP lainnya. Approach ini tidak prediksi tax evasion melainkan track noncompliance yang sudah terjadi. DJP mengembangkan aplikasi Approweb (Aplikasi profil berbasis web) untuk penyandingan data internal dan eksternal. Account Representative (AR) di setiap KPP memutakhirkan profil WP via Approweb, lalu mengirim Surat Permintaan Penjelasan atas Data dan/atau Keterangan (SP2DK) kepada WP yang dicurigai tidak patuh.","{}"
"paper_saptono_khozen","policy_recommendation_pandemi","Rekomendasi paper Saptono & Khozen (2021) untuk pandemi: otoritas pajak Indonesia perlu merekonstruksi interaksi dengan WP — bukan kebijakan rigid per fase pyramid, tapi adaptasi kontekstual. Berikan stimulus sambil tetap kontrol kepatuhan. Untuk konteks JR pilot, rekomendasi ini diadaptasi: stimulus = amnesti differentiated (M1 parsial, M2 penuh, S1 BBNKB reduction). Kontrol kepatuhan = razia pasca-amnesti + ETLE integration + Duta Pajak community presence. Pendekatan ini mengkombinasikan side keadilan (memberi kesempatan) dengan side ketegasan (penegakan setelah deadline).","{}"
